Текст,Рейтинг,Дата,Заголовок,Тип
"Среди большого количества выходящих в последнее время фильмов о космосе 'Интерстеллар', безусловно, заслуживает особого внимания.В первую очередь, это фильм с очень увлекательным сюжетом. Когда условия для жизни на Земле становятся слишком тяжёлыми и человечеству всё труднее выживать в пыли и засухе, группа исследователей отправляется в космос, чтобы через открывшийся пространственно-временной туннель попасть на новую планету, пригодную для жизни, которая могла бы стать новым домом для землян. С научно-технической точки зрения сюжет закручен довольно лихо и небанально, но при этом фильм не перегружен излишними деталями, и ничего не мешает следить за рассуждениями о том, что на самом деле может (или не может) происходить далеко-далеко от нас, за неизведанными чёрными дырами.Поначалу, в 'земной' части действия, сюжет развивается немного неторопливо, но потом набирает обороты, и оторваться от экрана становится всё сложнее. На фоне интерьеров космического корабля, захватывающих видов галактик и пейзажей незнакомых планет в 'Интерстелларе', как и положено настоящей хорошей фантастике, разворачивается история не только о космосе, но и о людях, о поиске, о выборе, а самое главное - об отчаянии и надежде.В фильме много эмоциональных и запоминающихся моментов. Например, сцена в школе, где училась маленькая Мёрф и где начинают переписывать учебники по истории - сколько революционного на самом деле для человечества во фразе 'сейчас нам нужно учить детей жить на этой планете, а не рассказывать сказки о том, как покинуть её'. Действительно ли это так?Или возвращение Купера и Амелии на корабль после всего лишь нескольких часов (часов ли?), проведённых на исследуемой планете после затопления корабля. Кто из них был прав, выбирая маршрут?Или бесконечно трогательная финальная сцена разговора Купера и повзрослевшей Мёрф. Не должен ли он был остаться со своей семьёй тогда, в начале фильма? В фильме столько вопросов, и так интересно самому пытаться искать на них ответ.На самом деле много чего ещё прекрасно в фильме - есть и хороший саундтрек, очень точно соответствующий происходящему на экране, есть и юмор (чего стоят одни диалоги с Купера и робота Тарса об уровне откровенности), есть и завораживающая картинка, есть и красивый яркий финал. И в результате 'Интерстеллар' - это отличное, интересное кино, в котором многое заставляет задуматься и которое вне всякого сомнения стоит посмотреть, чтобы лишний раз попытаться представить, что же будет с нами дальше, и просто насладиться хорошим фильмом.10 из 10",0,11 мая 2016 | 14:50,"О космосе, о людях и о человечестве",Положительный
"Вот было же, ну было же у меня предчувствие, что не нужно смотреть этот фильм! Ещё когда он вышел, 2 года назад! Когда все сходили по нему с ума, советовали друг другу и выносили кинотеатры! Вот вечно так: смотришь трейлер, читаешь, понимаешь, что лучше не смотреть... потом забываешь про это, слушаешь какие-то восторженные отзывы людей, и - вуаля! 3 часа жизни и сожаление. Ибо нефиг слушать чужие рекомендации.'Отличный фильм...' - говорили они. 'Я плакала в конце...' - говорили они. А я в конце смотрела 'Все грехи фильма 'Интерстеллар' и обраченно кивала головой. Ну нельзя же так, ребята! Ну нельзя же так запутывать сценарий, что уже в середине фильма непонятно, что происходит вообще. Ну нельзя делать персонажей - 'самых достойных представителей человечества' сумасбродными слабаками, спорящими о простых решениях в то время, пока человечество активно пытается погибнуть. Ну нельзя пихать столько набивших оскомину клише типа 'спасение чудесным образом в последнюю секунду' и 'выбор между любовью и долгом, от которого зависит жизнь человечества' в один фильм. Ну нельзя так притягивать сюжет за уши - они и так у него, как у осла... Да у вас чёрная дыра в фильме не такая устрашающая, как многочисленные сюжетные. Ребята, ну что же вы.Мне же так нравилась Энн Хэтэуэй и тема космоса... Но не с вами, ребята, нет. Нам с вами не по пути. Потому что стыдно выдавать такие слабые сценарии за высокохудожественное кино. Спецэффектами вы может кого-то и ослепили, но не меня. Показали бы просто пейзажи пыльной земли, космоса и других планет, без всех этих непонятных людей и обидных ляпов, было бы лучше. Итог: 4 балла за красивые волны на планете воды и попытку раскрытия темы альтернативного будущего.",0,06 мая 2016 | 10:35,Доверяйте предчувствию,Отрицательный
"Пробегусь по разным аспектам фильма, его составляющих.Музыка: Ханс Циммер как всегда на высоте. Саундтрек захватывает, подчеркивает события фильма так, что вы всегда в напряжении и в сопереживании.Актеры: К ним претензий не имею. Сыграли все на отлично. В особенности мне понравился Мэттью.Спецэффекты: Они, ровно как и стремление все события в фильме изобразить и приблизить к реальным законам физики - впечатляют. Это приятный элемент, порой мотивирующий фантазировать на такую тему.Сценарий: Самая идея, незаметно несет в себе романтику. Но есть один прокол, присущий множеству фильмов. Словно режиссер пошел на какой то компромисс. Купер сказал как то: Что бы чего-то достичь, нужно от чего то избавиться. Но при этом, режиссер старается нарушить эту закономерность. Возможно, Кристофер Нолан  все же понимал аспекты того, как и куда перетекает данная закономерность, и концовка фильма лишь коммерческий ход. Пересматривая фильм, понимаешь, что ведь он мог стать вековым. Этот компромисс в виде маленького кусочка сказки в конца фильма, несколько перечеркивает смысл определенных эмоций одного персонажа в фильме.Вы можете найти для себя много главных идей фильма, то чем вдохновиться. Это  любовь, и  романтика, борьба за жизнь, борьба со страхом, самопожертвование, сплоченность. И все это сыграли наилучшим образом, сильными, убедительными эмоциями. Вам понравится.9 из 10",0,02 мая 2016 | 14:05,Моё мнение о фильме.,Положительный
"Картина выше всех похвал, которую можно считать не лучшей драмой года, а одним из лучших фильмов всех времен.Сюжет здесь очень богат, раскрыта не только история спасения целого человечества, а также есть тема семьи и любви, безусловно к которым нельзя быть равнодушными. В процессе просмотра фильм не только восхищает, но и заставляет задуматься и открывает тему философии, о которой просто не получается не думать. После первого раза просмотра, я был просто восхищен, через некоторое время, после второго раза просмотра я был в восторге. Единственное о чем я жалею - это то что я смотрел этот фильм уже не в кинотеатре, где о фильме было бы еще больше впечатлений. После просмотра остаются только самые приятные воспоминания и впечатления.Раскрыта очень важная тема - космос. В картине есть просто потрясающие виды нашей вселенной, множество планет, на которой возможно могла бы сформироваться жизнь. Невереятные инопланетные пейзажи, примеры неизвестных планет и их атмосфера, которые не только не удивляют и захватывают, но и оставляют в памяти загадочность, необъятность...Актеры отлично подошли, они сыграли свои роли блестяще, трудно было бы представить на их месте других. Это безусловно хороший подбор.Саундтреки и музыка в фильме - это отдельная тема. Во многих моментах она так пронзительно вызывает трогательные чувства, что нельзя смотреть без 'сухих' глаз, в других моментах аж возникают мурашки под кожей от поразительного и невероятного. Необъятно погружаешься в атмосферу и весь фильм смотрится на одном дыхании.Итог: Интерстеллар - больше чем просто фильм, после просмотра которого оценка и не важна, ведь он и шедевр и гениальная картина. Кристофер Нолан снимает не просто интересеные и зрелищные фильмы, он их создает от души. К просмотру будет интересен всем зрителям, которые смотрят не только из - за 'галочки' и для развлечения, а тем кто думает и погружается в фильм без остатка!",0,01 мая 2016 | 15:23,Интерстеллар - пространство сквозь время,Положительный
"Кукурузные поля, твёрдые облака, планета, перемалываемая огромными приливным волнами и прочие зрелищные декорации и выстраивают «Интерстеллар». Да и не только эти декорации: герои с их искусственными конфликтами тоже становятся фоном общей идеи картины, а не участников действия. А идея эта заключается во всепобеждающей силе любви, которая преподносится нам выше силы прогресса, даже выше здравого смысла. Но и эта абстрактная любовь какая-то ненатуральная в картине и не создаёт атмосферу.Произведение искусство должно пробуждать у человека ворох дум, оно должно оставить отпечаток и заставлять вспоминать поднятые вопросы. А в «Межзвёздном» даже не смогли создать проработанный мир (вся эта кукуруза, бессмысленный киберкуб и другие ненаучные сюжетные глупости). А главное здесь нет полифонии идей, которые и делают фильм многослойным, интересным любому зрителю, который найдёт на зеркале экрана что-то своё, что-то близкое и жизненное или далёкое и философское, но понятное и необходимое.Научная фантастика ведь это такой жанр, который позволяет посмотреть на нашу реальность под другим углом, позволяет отойти от стереотипов, заставляя узнавать знакомое в незнакомом. В кинокартине К. Нолана не найти ничего кроме очередной катастрофы (конца света) и очередного героического способа всех спасти. Какой бы не была сила эмоций, сила нолановской любви, она ничто без силы разума, без прочных идей и самодостаточного мировоззрения.Успех фильма объясняется единственно отсутствием в кино достойных конкурентов в жаре. Научная фантастика изначально обладает некой магией будущего, она поражает фантазией художника. Но те, кто знаком с качественной литературой, где писатели действительно используют потенциал отстранённости от реальности, где задаются действительно важные и, что самое главное, интересные вопросы, никогда не купятся на дешёвую драму «Интерстеллара».Очередной киноаттракцион, который хочет казаться умным.",0,29 апреля 2016 | 12:06,Набитый кукурузой киберкуб,Отрицательный
"На свете существуют различные способы сойти за умного.Самый бесхитростный и часто практикуемый  - игра в молчанку.Но к нему довольно сложно прибегать, если снимаешь кино. И в немом фильме должен быть сюжет, а в идеале (говорят, так в старину бывало) даже идея.Поэтому, если ты снимаешь кино и хочешь сойти за умного, нужно играть не в молчанку, а в имитацию. В имитацию этого самого ума.В подобной игре хорошо помогает использование длинных слов, которые расстраивали в свое время Винни-Пуха. Скажешь, например: «Интердепенденция», и все сразу уважительно притихнут.Если использовать много длинных сложных слов одновременно, получается еще лучше.Хотите сойти за интеллектуала, попробуйте как-нибудь задать окружающим вопрос: «Возникает ли позиционный сигнификатизм гентильной теоpии психоанализа пpи паpаллельном коллабоpационном анализе спектpогpафичеких множеств, изомоpфно pелятивных к мультиполосным гипеpболическим паpаболоидам интеpпpетиpующим антpопоцентpический многочлен Hео-Лагpанжа?»Поверьте, эффект вас потрясет. В крайнем случае, побьют за «многочлен», но давно известно, что от ума бывает горе.Если не хотите рисковать с «многочленом», и у вас при этом есть 165 миллионов долларов, модные артисты на главные роли,Майкл Кейндля придания веса и ведущие физики, которые расскажут про черную дыру и прочие парадоксы Эйнштейна, то можете попытаться снять фильм про космос.Не беда, что в космос у вас полетит фермер – бурильщики как-то раз летали, и ничего (в следующий раз попробуйте послать кочегара, поглядите, как он там справится).Не страшно, что ваши набросанные тремя штрихами персонажи будут разговаривать, как инструкции к пользованию газовой плитой:«С появлением детей становится очевидно, что их безопасность превыше всего».В крайнем случае, попытайтесь как-то сгладить это глубинной философией о человеческих отношениях:«Может быть, любовь — это нечто большее, что мы не в силах пока осознать».Если и это не поможет, переходите к прямой постановке задачи, озвученной плакатными лозунгами:«Нам не суждено спасти этот мир. Нам суждено его покинуть».Видите, как хорошо?Как говорили в другом фильме-антиутопии с пыльными пейзажами: «Народу нравится!»Еще бы ему не нравилось. Прикоснувшись к высотам этих глубин, никто не останется равнодушным. Писатель Станислав Ежи Лец недаром когда-то говорил:«Людям, как я заметил, нравятся такие мысли, которые не заставляют думать».Если же вдруг в аудитории обнаружатся зрители, которые, в принципе, не против иногда и подумать, цитируйте известные стихи, давно признанные художественно ценными. Например, «Не уходи безропотно во тьму».И не один раз цитируйте, а три! Чтобы уж наверняка. Чтобы сомнений никаких не осталось: «ЭТО ИНТЕЛЛЕКТУАЛЬНОЕ КИНО».Конечно, всегда найдутся несогласные. Те, которые скажут, что сцена: «мужик летел по черной дыре, зацепился ботинком за орбиту нашей планеты, и тут мы его спасли» - это курам на смех.Не обращайте на них внимания. И не реагируйте на смех. Держите серьезное лицо, пока судорогой не сведет. Всем известно, что серьезное лицо это первый признак ума.Ну, готовы?Протрите тряпочкой черную дыру, чтобы заблестела, заводите свою Циммер-шарманку на полную громкость, запускайте фермера на орбиту, пусть он оттуда умилится, как прекрасна наша саванна с высоты птичьего полета, и включите режим ожидания дочери – это эмоционально тонкий, удивительный, а, главное, редкий сюжетный ход.Итак…Три, два, один, ноль…«…Пространственно-временные континуумы представляют собой простейшее обобщение обычного спрямленного пространства. Кривизна спрямленного пространства равна нулю, и его двумерным аналогом является…Может, нам стоит довериться любви, хоть мы и не понимаем ее сути?»1 из 10.Как представлю, сколько за 165 миллионов долларов можно было голодных накормить, сколько болящих вылечить, сколько разрушающихся зданий отреставрировать...А, может быть, даже построить машину времени, вернуться в прошлое и повлиять наКристофера Нолана, чтобы он нашел своим талантам достойное применение - пошел бы в политику и читал бы с трибуны речи:  «Что мы имеем сейчас? Мы имеем президента, вот президент есть. По Конституции он полновластный организатор всей политики. Дальше идет дырка. Будет координация, это без проблем. Но в целом, концептуально, закон сейчас необходим. Все. Спасибо».",0,24 апреля 2016 | 01:38,Игра в имитацию,Отрицательный
